{
  "version": 1,
  "id": "synthetic-pending-amendment",
  "subject": "https://example.org/instrument/synthetic-duty",
  "as_of": "2026-06-01",
  "condition": {
    "description": "The amending instrument has entered into force as of the evaluation date. Adoption alone does not satisfy this condition.",
    "status": "unknown",
    "observed_on": "2026-05-20",
    "source": {
      "url": "https://example.org/synthetic-evidence",
      "locator": "Synthetic amendment commencement observation"
    }
  },
  "expected": {
    "date": "2027-01",
    "source": {
      "url": "https://example.org/synthetic-amendment",
      "locator": "Synthetic amended planning date"
    }
  },
  "fallback": {
    "date": "2026-06-30",
    "source": {
      "url": "https://example.org/synthetic-predecessor",
      "locator": "Synthetic unamended scheduled date"
    }
  },
  "assertion": {
    "branch": "unknown",
    "date": null,
    "state": "unknown"
  }
}
